{
  "tx": {
    "lat": 0.0,
    "lon": 0.0,
    "height_m": 0.0,
    "mode": "AGL",
    "freq_mhz": 145.0,
    "erp_watts": 50.0
  },
  "rx": {
    "height_m": 1.5,
    "mode": "AGL"
  },
  "analysis": {
    "task_type": "BATCH_P2P",
    "propagation_model": "ITM",
    "max_range_km": 80,
    "resolution_m": 30,
    "min_db": -140.0,
    "batch_file": "./batch_links.csv"
  },
  "output": {
    "directory": "./out/batch_p2p",
    "filename": "p2p_results"
  },
  "processing": {
    "terrain_dir": "./data/cache_abt",
    "max_vram_usage_gb": 8
  },
  "propagation": {
    "radio_climate": 5,
    "pol": 0
  }
}
