{
  "tx": {
    "lat": 47.3700,
    "lon": 8.5400,
    "height_m": 25.0,
    "mode": "AGL",
    "freq_mhz": 145.0,
    "erp_watts": 50.0
  },
  "rx": {
    "height_m": 1.5,
    "mode": "AGL"
  },
  "analysis": {
    "task_type": "SINGLE",
    "propagation_model": "LOS",
    "max_range_km": 30,
    "resolution_m": 10,
    "min_db": -140.0,
    "compute_backend": "AUTO"
  },
  "output": {
    "directory": "./out/coverage_los",
    "filename": "coverage_report"
  },
  "processing": {
    "terrain_dir": "./data/cache_abt",
    "max_ram_usage_gb": 16,
    "max_vram_usage_gb": 8
  }
}
